X1,doc_id,triple,src_file_id,file_section_id,section_sentence_id,src_column,speechdate,debate,text,year,decade
23460204,S4V0043P0_6742,landlord-have-power,S4V0043P0,54,24,206,1896-07-20,"TURBARY AND OTHER PROFITS, EASEMENTS, AND PRIVILEGES.","Gentleman say there was a good deal to be said, was, that if the landlord wished to withdraw that which had been granted as a mere matter of grace or favour, and not as a contract at all, and the tenant persisted in acting in such a way as if the favour were still to continue, the landlord was to have no power whatever of enforcing the rights upon his own property.",1896,1890
23463847,S4V0043P0_8396,landlord-have-power,S4V0043P0,52,97,325,1896-07-21,EJECTMENTS FOR NONPAYMENT OF RENT IN CASE OF HOLDINGS UNDER LAND LAW ACTS.,"But the landlord had power immediately afterwards, even if the Amendment of the hon.",1896,1890
23470177,S4V0043P0_11070,landlord-have-power,S4V0043P0,73,3,566,1896-07-23,"AMENDMENT OF SECTION 57 OF THE LAND LAW (IRELAND) ACT, 1881.","It was a reasonable thing that a landlord should have power to make a future tenant into a present tenant, whether he had previously occupied the holding or not, and the Government were prepared to accept a new clause to that effect.",1896,1890
23514434,S4V0044P0_7951,landlord-have-power,S4V0044P0,19,733,634,1896-08-12,LAND LAW (IRELAND) BILL.,"If a landlord had the power to say to a tenant, ""You shall have no turbary if you get a fair rent fixed, "" how was the tenant to be compensated?",1896,1890
23514459,S4V0044P0_8041,landlord-have-power,S4V0044P0,19,823,641,1896-08-12,LAND LAW (IRELAND) BILL.,The landlord had at his back all the power that wealth could give him and would be able to oppress the tenant with expensive litigation.,1896,1890
514272,S3V0121P0_6504,landlord-have-power,S3V0121P0,0,131,274,1852-05-05,TENANT-RIGHT (IRELAND) BILL.,"If the landlord had the power of settling his own rent, the Bill would be so much waste paper, for he would say to his tenant—""I will let you the land under the old system for 15 s. an acre; but if you take it subject to the provisions of Mr. Crawford's Bill, you must pay me 25 for it. """,1852,1850
514281,S3V0121P0_6523,landlord-have-power,S3V0121P0,0,150,276,1852-05-05,TENANT-RIGHT (IRELAND) BILL.,The landlord would then have neither power nor incentive to discharge those duties so neces- sary for his own and his tenant's welfare.,1852,1850
648007,S3V0233P0_26743,landlord-have-power,S3V0233P0,4,12,1865,1877-04-25,[BILL 32. ] SECOND READING.,"On the other hand, in England there was no lien for accruing rent, but in the case of rent accrued the landlord had power to enforce payment without reference to any Court, and by his own motion.",1877,1870
660970,S3V0250P0_9361,landlord-have-power,S3V0250P0,25,129,528,1880-02-12,RELIEF OF DISTRESS (IRELAND. ),"He (Mr. Biggar) contended that no landlord ought to have the power to turn a tenant out without compensation, and that the State should say that nothing more than a fair and reasonable rent should be paid, and that an attempt should be made to establish what was called a peasant proprietary.",1880,1880
800135,S3V0325P0_9596,landlord-have-power,S3V0325P0,5,1077,501,1888-04-25,SECOND READING.,"There was a special power given by the Labourers' Cottages Act to Boards of Guardians to provide labourers' cottages out of the rates, and in many cases the landlords have only been protected by the action of the Privy Council from having this power used by the Boards of Guardians for no other purpose than the direct oppression of individuals.",1888,1880
894472,S4V0005P0_2940,landlord-have-power,S4V0005P0,10,7,1539,1892-06-20,DRAINAGE AND IMPROVEMENT OF LAND (IRELAND) (No. 2) BILL.,"In other words, I must point out to my noble Friend that, if a sufficient number of tenants may vote for a scheme, the landlord still has the power of veto.",1892,1890
995745,S4V0195P0_880,landlord-have-power,S4V0195P0,6,20,242,1908-10-28,LAW OF DISTRESS AMENDMENT BILL.,"The landlord was not to get his rent, but would have power to re-enter.",1908,1900
