X1,doc_id,triple,src_file_id,file_section_id,section_sentence_id,src_column,speechdate,debate,text,year,decade
1253516,S2V0009P0_7970,landlord-have-power,S2V0009P0,4,13,560,1823-05-27,IRISH JOINT TENANCY BILL. ],"In short the landlord had every power over them, save that of life and death.",1823,1820
1253522,S2V0009P0_7989,landlord-have-power,S2V0009P0,4,32,560,1823-05-27,IRISH JOINT TENANCY BILL. ],"That it would check fictitious freeholds he would admit; but the number of bonâ fide voters would be increased: and they would be infinitely less dependent, as the landlord could have no further power over them, than the demand for the rent of each tenant, for which alone he could be responsible.",1823,1820
1888580,S2V0024P0_16774,landlord-have-power,S2V0024P0,11,610,1240,1830-05-28,PARLIAMENTARY REFORM. ],"No: if they did discuss those merits, unless hypocrisy was afterwards made use of, the landlord would have just as much power of discovering what the vote of his tenant was, whether the discussion took place in the public-house or on the hustings; neither did he believe that any assurance could be given that the ballot would be fairly taken.",1830,1830
1937125,S3V0001P0_12751,landlord-have-power,S3V0001P0,2,313,929,1830-12-09,GRAND JURIES (IRELAND). ],"Landlords ought to have the power of levying these taxes, and that system would be no improvement which took that power from them.",1830,1830
2238264,S3V0006P0_10373,landlord-have-power,S3V0006P0,3,102,678,1831-08-26,PARLIAMENTAY REFORM—BILL FOR ENGLAND—COMMITTEE—THIRTY SECOND DAY.,The landlord and the tenant had the power of making their own arrangements.,1831,1830
2496247,S3V0011P0_4755,landlord-have-power,S3V0011P0,2,428,170,1832-03-13,TITHES (IRELAND. )],"The landlord ought to bear the tithes, but then the landlord ought to have the same powers for collecting the tithes that he had for collecting his rent.",1832,1830
2837655,S3V0017P0_5402,landlord-have-power,S3V0017P0,2,71,273,1833-04-18,COMMUTATION OF TITHES (ENGLAND). ],The landlords also might have the power to make an arrangement with the tithe-receivers whether they had granted a lease or not.,1833,1830
2850034,S3V0017P0_9940,landlord-have-power,S3V0017P0,2,48,608,1833-04-25,ELECTION BY BALLOT. ],"What need is there to enact by law, that the landlord shall have power over the vote of his tenant?",1833,1830
2850036,S3V0017P0_9941,landlord-have-power,S3V0017P0,2,49,608,1833-04-25,ELECTION BY BALLOT. ],"The landlord has himself the power of enforcing his own dictation, and of inflicting a penalty on disobedience, much more serious than any which the law would provide—ejectment from house and home.",1833,1830
3242994,S3V0024P0_17290,landlord-have-power,S3V0024P0,1,932,1204,1834-07-04,CHURCH TEMPORALITIES AND TITHES (IRELAND). ],"If he understood the Bill, the landlord had the power of recovering in the shape of rent, if not in the shape of tithes, a sum equal to the limited amount he paid to the public.",1834,1830
3286248,S3V0025P0_13374,landlord-have-power,S3V0025P0,1,220,768,1834-07-30,TITHES (IRELAND)],"It was said, that the landlords would have the power of recovering the amount along with the rent, by the process of ejectment.",1834,1830
4409893,S3V0046P0_13790,landlord-have-power,S3V0046P0,0,71,945,1839-03-20,SALE OF BEER. ],"Under this bill the landlord would have the whole power of the licensing magistrates, and to that he should prefer the old system.",1839,1830
6067205,S3V0081P0_3966,landlord-have-power,S3V0081P0,3,6,1115,1845-06-24,TENANTS COMPENSATION (IRELAND) BILL—QUESTION. ],"Whether the landlords should have the power of interposing a veto, and of preventing such improvements, was a question entirely open to the House to consider in Committee; and no noble Lord would be pledged by agreeing to the second reading of the Bill, but was at perfect liberty to reject the measure when before their Lordships.",1845,1840
6068960,S3V0081P0_4270,landlord-have-power,S3V0081P0,4,298,1141,1845-06-24,TENANTS COMPENSATION (IRELAND) BILL. ],"A period was then to be given to the landlord to object; and it would be a question, which he admitted to be fairly an open question, whether the landlord should have the power, at that stage, to put a veto on the further proceeding.",1845,1840
6320324,S3V0085P0_7667,landlord-have-power,S3V0085P0,3,125,383,1846-04-01,DESTITUTE POOR (IRELAND).,Thus Lord Brougham expounded the law to be that the landlord had the power of sweeping off the entire population of his estate.,1846,1840
6325518,S3V0085P0_8873,landlord-have-power,S3V0085P0,0,133,493,1846-04-03,PROTECTION OF LIFE (IRELAND) BILL.,The landlord has additional powers to levy his rent—,1846,1840
6578075,S3V0089P0_15649,landlord-have-power,S3V0089P0,2,124,1165,1847-02-11,LAW OF LANDLORD AND TENANT (IRELAND).,"In order to induce the landlords to do so, he thought it would be necessary to sever the elective franchise from tenure; because, while the landlords had the power of creating votes, they dreaded their being used against their views.",1847,1840
6596994,S3V0090P0_2441,landlord-have-power,S3V0090P0,0,26,1004,1847-03-08,POOR LAW (IRELAND).,"In Ireland the landlords had the power of levying a distress upon the goods and chattels of the tenant for rent; and such processes as those before the barrister, which involved personal attachment, were perfectly novel in that country.",1847,1840
6713459,S3V0092P0_2037,landlord-have-power,S3V0092P0,0,132,557,1847-05-10,POOR RELIEF (IRELAND) BILL.,"Do you think that the same landlords who have now the power and the will, according to you, to exact the uttermost farthing from their tenantry—to screw every shilling and every penny which they can drag from them by any means in their power—do you believe that these landlords will not protect themselves against your legislation by demanding from their tenants an increased rent to cover the increased rate?",1847,1840
7024213,S3V0097P0_19412,landlord-have-power,S3V0097P0,0,197,1325,1848-04-05,OUTGOING TENANTS (IRELAND) BILL.,"Any plan about recognising improvements only, raised two formidable and insuperable questions: first, as to what landlords and tenants would consent to consider as improvements; and, secondly, what the value, and apportionment to each of such value, was to be; whereas tenant-right, as in the north, simplified everything by leaving the tenant to find the value of his holding and improvements, if any, in the open market; while, at the same time, the landlord had full power to raise the rent, and was secure of arrears.",1848,1840
7129493,S3V0100P0_12363,landlord-have-power,S3V0100P0,2,51,768,1848-07-24,INCUMBERED ESTATES (IRELAND) BILL.,"The persons to whom it is intermediately let, can only be looked upon as so many encumbrancers upon the estate; but the original landlord—he who is the possessor of the soil so far as the law is concerned—has no more power over it than any of us, and can have no interest in improving that estate.",1848,1840
7138586,S3V0100P0_15297,landlord-have-power,S3V0100P0,0,110,985,1848-07-29,REMEDIAL MEASURES FOR IRELAND—ADJOURNED DEBATE.,"The landlords, as a body, small as their numbers were—about 8, 000 holding in fee—had the power of clearing from the face of Ireland the whole of the population—",1848,1840
7369950,S3V0105P0_3145,landlord-have-power,S3V0105P0,3,98,637,1849-05-18,POOR LAWS (IRELAND)—RATE IN AID BILL.,At present the landlords had no such power.,1849,1840
7393653,S3V0105P0_11921,landlord-have-power,S3V0105P0,1,513,627,1849-05-17,POOR RELIEF (IRELAND) BILL.,"Member here entered into details explaining the causes of the increase of a poor population upon Irish estates, and argued that the landlords had no power to prevent it, although they were blamed for it, as well as for everything else, according to the usual system which prevailed of calumniating Irish proprietors.",1849,1840
7514398,S3V0108P0_17375,landlord-have-power,S3V0108P0,3,69,1291,1850-02-22,"PARLIAMENTARY VOTERS, ETC. (IRELAND) BILL.","What he (Mr. Reynolds) had to complain of was, that the landlords, as things at present stood, had a great deal too much power in Ireland.",1850,1850
7539123,S3V0109P0_6999,landlord-have-power,S3V0109P0,4,74,321,1850-03-04,PARLIAMENTARY VOTERS (IRELAND) BILL.,"Then, in that case, the landlord would have the power to add two votes.",1850,1850
7633274,S3V0110P0_19010,landlord-have-power,S3V0110P0,6,350,1339,1850-05-10,PARLIAMENTARY VOTERS (IRELAND) BILL.,"But so long as the landlord, at his will and pleasure, has the power, by refusing a lease, to deprive his tenant of a qualification, so long will he (Mr. Fagan) object to the proposition of a tenure franchise advocated by Gentlemen opposite.",1850,1850
7848125,S3V0115P0_18900,landlord-have-power,S3V0115P0,4,294,1287,1851-04-08,STATE OF IRELAND.,"Baronet (Sir H. W. Barron) express his regret that the landlords had not greater power given them in the administration of the Poor Law, notwithstanding that already the unfortunate people were handed over to them bound neck and heels.",1851,1850
7904335,S3V0117P0_17200,landlord-have-power,S3V0117P0,1,40,1230,1851-06-25,INCUMBERED ESTATES LEASES (IRELAND) BILL.,"Friends opposite were well aware, from the time a mortgage was executed by the old proprietor, he had ceased to be able to make a lease; and by this Bill they would place the tenant in a position which the landlord would have put him in if he had had the power.",1851,1850
8446541,S3V0128P0_11522,landlord-have-power,S3V0128P0,1,10,730,1853-06-24,LANDLORD AND TENANT (IRELAND) BILL.,"said, he thought there would be a great deal of hardship if a landlord had the power of turning out this class of tenants at a month's notice in the middle of the winter.",1853,1850
8469581,S3V0128P0_18987,landlord-have-power,S3V0128P0,0,52,1371,1853-07-07,LANDLORD AND TENANT (IRELAND) BILL.,A landlord in Scotland had no such power of appointment as Was given by this clause; and he (Mr. Dunlop) was strongly opposed to the introduction of such a principle into the relationship between landlord and tenant.,1853,1850
8471217,S3V0128P0_19601,landlord-have-power,S3V0128P0,0,73,1418,1853-07-08,LANDLORD AND TENANT (IRELAND) BILL.,"The landlord had power, however, already to eject any tenant who owed him a year's rent; and the only advantage which he would derive from this clause was, that in a suspicious case he might distrain growing crops to recover half a year's rent.",1853,1850
8499242,S3V0129P0_6869,landlord-have-power,S3V0129P0,0,26,31,1853-07-11,LANDLORD AND TENANT (IRELAND) BILL.,"It was, that whereas the landlord had the power of distress for the recovery of six years' arrears, this Bill reduced it to one year, while great improvements were introduced in the mode of proceeding.",1853,1850
8530957,S3V0129P0_17607,landlord-have-power,S3V0129P0,4,9,1113,1853-08-01,LANDLORD AND TENANT (IRELAND)BILL.,"For instance, under the existing law a landlord had the power of distraining for any amount of rent that might be due to him; but by that measure the power of distraint to be possessed by a landlord was limited to the amount of a year's rent.",1853,1850
8530959,S3V0129P0_17608,landlord-have-power,S3V0129P0,4,10,1113,1853-08-01,LANDLORD AND TENANT (IRELAND)BILL.,"Again, a landlord had the power under the existing law of issuing a warrant of distress signed by himself or his agent; while under that Bill he would be obliged to make an application to a magistrate, who alone could issue such a warrant.",1853,1850
8587703,S3V0130P0_10528,landlord-have-power,S3V0130P0,7,44,770,1854-02-16,TENANTS' COMPENSATION (IRELAND).,"Was it reasonable that where the tenant fell into arrear the landlord should have the power of evicting him, and thus, to use a local phrase, ""rob him of his improvements?",1854,1850
8587706,S3V0130P0_10531,landlord-have-power,S3V0130P0,7,47,770,1854-02-16,TENANTS' COMPENSATION (IRELAND).,It was therefore unreasonable that the landlord should have the power of taking away the tenant's whole property in his improvements.,1854,1850
8613336,S3V0131P0_95,landlord-have-power,S3V0131P0,2,91,2,1854-02-28,LEASING POWERS (IRELAND) BILL—LANDLORD AND TENANT (IRELAND) BILL.,"There was then a proviso, that the landlord should have the power to buy the fixtures, their value to be settled by arbitrators.",1854,1850
8747630,S3V0133P0_1743,landlord-have-power,S3V0133P0,2,220,533,1854-05-18,THE IRISH LAND BILLS.,"The landlord had more summary powers given to him than he possessed at present; and, on the other hand, before he could recover his rent, he must show that he had performed his duty in keeping the property in proper repair.",1854,1850
9392647,S3V0141P0_598,landlord-have-power,S3V0141P0,0,46,445,1856-04-04,AGRICULTURAL STATISTICS BILL.,"Well, supposing the magistrate to be the landlord of the individual called upon to make the return, he is asked to give no information but that which the landlord has power, at any moment, to ascertain.",1856,1850
10182704,S3V0150P0_6713,landlord-have-power,S3V0150P0,5,86,181,1858-05-06,TENANT RIGHT (IRELAND).,"But even then, the landlord would have full power to consolidate small farms and evict his tenants; but he should do so after giving a fair compensation to the tenants for their existing improvements.",1858,1850
10239995,S3V0150P0_26384,landlord-have-power,S3V0150P0,2,363,1820,1858-06-09,SECOND READING—ADJOURNED DEBATE.,Gentlemen opposite in thinking that the landlord should have the power of making leases to his tenants under all circumstances.,1858,1850
10723820,S3V0157P0_23230,landlord-have-power,S3V0157P0,20,128,1553,1860-03-29,LEAVE. FIRST READING.,"Gentleman that the landlord will have the power of giving a lease, although his own settlement contains no such power, and, therefore, by an arrangement with his original landlord, the tenant will have the benefit of the protection afforded by the Act.",1860,1860
10724283,S3V0157P0_23397,landlord-have-power,S3V0157P0,20,295,1572,1860-03-29,LEAVE. FIRST READING.,"Was the landlord to have the power of saying to his tenant, ""For your audacity, Sir, in making this application to me, go about your business?""",1860,1860
12909140,S3V0189P0_7390,landlord-have-power,S3V0189P0,16,149,187,1867-07-26,OBSERVATIONS.,The landlords of Ireland had in their own hands the power of effecting great results.,1867,1860
13636105,S3V0199P0_18051,landlord-have-power,S3V0199P0,29,38,1373,1870-03-07,SECOND READING. FIRST NIGHT.,"Again, the landlord has the power, by tendering a thirty-one years lease, to absorb all improvements except those that come under the titles of permanent buildings suitable to the holding, and the reclamation of waste land.",1870,1870
13716297,S3V0200P0_16803,landlord-have-power,S3V0200P0,16,703,1219,1870-04-04,IRISH LAND BILL—[BILL 29. ],"Under the clause, as it originally stood, a landlord had the power of forcing a thirty-one years' lease on the tenant.",1870,1870
13765574,S3V0201P0_3997,landlord-have-power,S3V0201P0,8,327,31,1870-05-02,COMMITTEE. [Progress 28th April. ],Surely the landlord ought to have power to remove him without subjecting himself to the burdens of this clause.,1870,1870
13773407,S3V0201P0_6987,landlord-have-power,S3V0201P0,18,27,283,1870-05-05,COMMITTEE. [Progress 2nd May. ],"He also asked whether, as a landlord who was a limited owner would have the power of agreeing with, his tenants as to the amount of compensation which should be payable to them, an owner in fee would have a similar power?",1870,1870
13775215,S3V0201P0_7508,landlord-have-power,S3V0201P0,18,548,320,1870-05-05,COMMITTEE. [Progress 2nd May. ],"It would be most unfair for a landlord to have absolute power of preventing compensation being given for improvements, and the Government had come to the conclusion that the proper method for the landlord was to defend himself by contract.",1870,1870
13776792,S3V0201P0_8363,landlord-have-power,S3V0201P0,10,52,399,1870-05-09,COMMITTEE. [Progress 6th May. ],"When a tenant became bankrupt the landlord had the power to serve notice, calling upon the assignees to elect whether they would continue the tenancy or not.",1870,1870
13833787,S3V0202P0_421,landlord-have-power,S3V0202P0,5,411,21,1870-06-14,SECOND READING.,The landlord and tenant should also have the power of settling matters without going into Court.,1870,1870
13833933,S3V0202P0_677,landlord-have-power,S3V0202P0,5,667,53,1870-06-14,SECOND READING.,"There was one way in which this difficulty about tenant-right might be met, and that was by simply inserting in the Bill that which was univerversally acknowledged to be just—namely, that the landlord should have the power to accept or to refuse an incoming tenant.",1870,1870
13839680,S3V0202P0_2610,landlord-have-power,S3V0202P0,6,372,349,1870-06-17,SECOND READING. ADJOURNED DEBATE.,"That Report, no doubt, proclaimed a state of things with regard to the agricultural population that was very distressing; but it was well known, and admitted, to have been the result of over-population that had arisen from the excessive sub-dividing and sub-letting of farms held by lease, and which the landlords had no power of preventing.",1870,1870
14506080,S3V0211P0_1003,landlord-have-power,S3V0211P0,4,174,581,1872-05-10,COMMITTEE.,"said, nothing could be more unjust than to enact with reference to existing leases where the landlord had no power over the tenant, that the misconduct of that tenant should entail a forfeiture of property upon the landlord.",1872,1870
14506083,S3V0211P0_1006,landlord-have-power,S3V0211P0,4,177,581,1872-05-10,COMMITTEE.,"But whatever might be done, nothing could be more unjust than to apply the penalty of this clause to the case of existing leases, where the landlord had no power over the tenant.",1872,1870
14603500,S3V0213P0_8383,landlord-have-power,S3V0213P0,7,71,651,1872-08-07,CONSIDERATION. ADJOURNED DEBATE.,"and learned Friend the Member for Frome, when it was proposed, contended that the landlord should have the summary powers given him by the 2 & 3 Vict.",1872,1870
14603513,S3V0213P0_8417,landlord-have-power,S3V0213P0,7,105,654,1872-08-07,CONSIDERATION. ADJOURNED DEBATE.,"In order to protect the owner against the misconduct of bad tenants, he provided that, in regard to future leases, the landlord should have power, after the conviction of a tenant had been recorded, to oust him.",1872,1870
15173927,S3V0223P0_1210,landlord-have-power,S3V0223P0,1,228,936,1875-04-15,SECOND READING.,"It was said the landlord had too much power in fixing the rent; but there were two safeguards—first, the tenant ought to know what rent he should give, and, secondly, no sensible landlord would ask more than would give the tenant full opportunity of farming advantageously.",1875,1870
15302747,S3V0224P0_18515,landlord-have-power,S3V0224P0,3,111,1298,1875-06-02,[BILL 35. ] SECOND READING.,"The fundamental principle underlying the Ulster tenant-right was that the landlord had absolute power in selecting his tenant—and undoubtedly if the power of retaining landed property was to exist at all in Ireland, it was only reasonable that the landlord should-have some little voice in the management of his own estates.",1875,1870
15350534,S3V0225P0_9215,landlord-have-power,S3V0225P0,16,392,478,1875-06-24,[Lords. ] SECOND READING.,"It was, however, important to know whether either landlords or tenants would have the power to contract themselves out of a part of the Bill, leaving all the other parts intact.",1875,1870
15352350,S3V0225P0_9851,landlord-have-power,S3V0225P0,16,1028,522,1875-06-24,[Lords. ] SECOND READING.,"The landlord has power to execute such, and it is unnecessary to in- sert them.",1875,1870
15395983,S3V0225P0_24741,landlord-have-power,S3V0225P0,28,23,1830,1875-07-22,COMMITTEE. [Progress 20th July. ],"With respect to the second class, he proposed that the landlords and tenants should have power to make agreements in respect of any improvements the effects of which were likely to endure beyond two years.",1875,1870
15395985,S3V0225P0_24742,landlord-have-power,S3V0225P0,28,24,1830,1875-07-22,COMMITTEE. [Progress 20th July. ],"In other words, he proposed that, as regarded all improvements mentioned in the first and second classes, the landlords and tenants should have full power to contract, leaving the question as to manures and cake to be settled by the valuers.",1875,1870
15396110,S3V0225P0_25081,landlord-have-power,S3V0225P0,28,363,1853,1875-07-22,COMMITTEE. [Progress 20th July. ],thought that as to some of these provisions it was desirable that the landlord should have the power of objecting.,1875,1870
15405238,S3V0226P0_1992,landlord-have-power,S3V0226P0,30,228,74,1875-07-26,COMMITTEE. [Progress 23rd July. ],"He thought it was only right that the landlord should have such a power, and the referees after investigating the case would make the award either in favour of the landlord or tenant.",1875,1870
15552104,S3V0228P0_13992,landlord-have-power,S3V0228P0,2,110,771,1876-03-29,[BILL 10. ] SECOND READING.,The landlords who could serve notices to quit have two powers in their hands.,1876,1870
15552148,S3V0228P0_14077,landlord-have-power,S3V0228P0,2,195,771,1876-03-29,[BILL 10. ] SECOND READING.,"The landlord, of course, has the power in any time to put an end to the state of things by serving a notice to quit, and therefore virtually neither the landlord nor the tenant need ever resort to this Act, although I leave either of them the option of doing so.",1876,1870
15705436,S3V0230P0_11112,landlord-have-power,S3V0230P0,20,927,686,1876-06-29,SECOND READING. ADJOURNED DEBATE.,"And yet we are told that the Land Question is to be settled by mutual agreement between landlord and tenant, while the landlord has still the power of dictating such terms as these.",1876,1870
15957424,S3V0234P0_3381,landlord-have-power,S3V0234P0,15,118,36,1877-04-27,RESOLUTION.,"We seek to amend the Act, so that in no case shall the landlord have the power of evicting while the tenant pays a fair rent, and we propose to give the tenant the right of referring the decision of the question what is a fair rent to a tribunal equally representing landlord and tenant.",1877,1870
16061039,S3V0235P0_12296,landlord-have-power,S3V0235P0,6,32,782,1877-07-04,[BILL 86. ] SECOND READING.,"Then it was provided, on the other hand, that the landlord should have power to obtain compensation for depreciation, or else to eject the tenant.",1877,1870
16061040,S3V0235P0_12298,landlord-have-power,S3V0235P0,6,34,782,1877-07-04,[BILL 86. ] SECOND READING.,"It might seem hard to the tenant that the landlord should have that power, and representation of this point had been made to him by many farmers; but it seemed to him equitable and just that, while on the one hand the tenant had a right to claim from the landlord compensation for improvements, the landlord, on the other, should have a right to claim compensation for depreciation, and to ultimately eject a tenant who persisted, after the arbitrators had given their award, in exhausting or improperly cultivating the farm.",1877,1870
16122052,S3V0237P0_8296,landlord-have-power,S3V0237P0,22,173,504,1878-01-25,[BILL 43. ] SECOND READING.,"A bad landlord, after it passed, would still have the power of being a bad landlord.",1878,1870
16122066,S3V0237P0_8324,landlord-have-power,S3V0237P0,22,201,505,1878-01-25,[BILL 43. ] SECOND READING.,"Could there be anything more repugnant to the very essence of Ulster tenant-right, one of the conditions of which was that the landlord should have a substantial power of selecting or approving a tenant?",1878,1870
16146676,S3V0237P0_17280,landlord-have-power,S3V0237P0,2,502,1166,1878-02-06,[BILL 50. ] SECOND READING.,Clause 22 provided for notices to quit; but what was the use of a notice to quit when the landlord had no power to evict.,1878,1870
16146747,S3V0237P0_17427,landlord-have-power,S3V0237P0,2,649,1180,1878-02-06,[BILL 50. ] SECOND READING.,Then it was said that it was objectionable that the landlords should have the power of raising the rent to any amount they thought fit.,1878,1870
16148148,S3V0237P0_17632,landlord-have-power,S3V0237P0,2,854,1194,1878-02-06,[BILL 50. ] SECOND READING.,"Then again, in relation to the rent, the landlord would have no power over that.",1878,1870
16671287,S3V0245P0_5252,landlord-have-power,S3V0245P0,21,172,179,1879-04-01,COMMITTEE.,"The landlord had very drastic, extreme, and arbitrary powers against the tenant in arrear, and under this clause he would have the power of put, ting them in force whenever six months, rent was due and unpaid.",1879,1870
16671289,S3V0245P0_5253,landlord-have-power,S3V0245P0,21,173,179,1879-04-01,COMMITTEE.,"If the rent were even a day past due, the landlord would have the power to call the tenant before the Sheriff, and unless he found caution for the rent past due, and for two crops to come, the landlord might claim his ejectment.",1879,1870
16671306,S3V0245P0_5292,landlord-have-power,S3V0245P0,21,212,182,1879-04-01,COMMITTEE.,All he desired was that the landlord should have the power to recover possession of his land in lieu of the power of sequestration which he had before.,1879,1870
16992753,S3V0252P0_10351,landlord-have-power,S3V0252P0,43,164,605,1880-05-27,LEAVE. FIRST READING.,"He also understood that the landlord was to have the power to kill ground game if he liked, and that it was to be equally impossible for the tenant and for the landlord to part with their right to kill the game.",1880,1880
17085411,S3V0253P0_17246,landlord-have-power,S3V0253P0,4,21,1181,1880-06-30,[BILL 144. ] SECOND READING.,"Before the passing of that Act, the landlords had power to turn their tenants out at any time on a simple notice to quit, and without recognition of the labour or capital expended on the holding; but to their credit it might be said that, as a rule, that power was rarely-exercised.",1880,1880
